"순번","자치구","거리","소요시간","추천수","연계지하철역","연계코스","연계공원","교통편","상세코스","설명","코스명","코스대분류","강남강북구분","코스레벨"
"29","동대문구","3.51km","2시간","0","1호선,중앙선","","","진입로 1 : 시립대입구 버스 정류장 마을 동대문05 <br />    진입로 2 : 답십리2동한양아파트앞 버스 정류장(06-228) 간선 262, 지선 2112, 3220 <br />    진입로 3 : 배봉초등학교앞 버스 정류장(06-210) 지선 2015, 2233, 2311, 2230  <br />    진입로 4 : 도보진입 <br /> - 지하철 1호선, 중앙선 회기역 2번 출구에서 삼육병원으로 이동 배봉산근린공원입구로 진입(약 800m)<br /> ※교통편의 변경이 있을 수 있으니 출발전 확인 바랍니다.   "," 배봉산 출입구~답십리 근린공원~배봉산근린공원 진입"," 동대문구에서 조성한 녹지순환산책로를 접근이 용이하도록 재구성한 코스이다. 따라서 배봉산근린공원이 그 중심을 이룬다. 배봉산근린공원은 산이 부족한 동대문구의 보조 산소통이다. 배봉산은 동대문구 전농동에 있는 표고 110m의 산이다. 배봉산이라는 이름은 조선조 영조때 사도세자가 당쟁에 의해 죽은 뒤 이곳에 장례를 지냈는데, 사도세자의 아들인 정조가 평생에 못다한 불효를 속죄한다며 날마다 부친의 묘소를 향해 배례를 하면서 산이름이 배봉산(拜峰山)으로 불려졌다. 서울시립대학교가 위치해 있으며, 조선시대 영우원과 휘경원 등 왕실 묘원이 마련되어 있었으며, 목마장의 울타리가 지났던 곳이다.<br /> ※배봉산은 작은 동산이라 누구나 쉽게 오를 수 있고 능선도 완만하게 이어져 시민들에게 사랑받는 산책로이다. 높은 산처럼 조망이 좋지는 않지만 우거진 나무들 덕에 가을에는 낙엽을 밟으며 가을을 몸으로 느낄 수 있다.","배봉산 답십리 나들길","생태문화길","강북권","중급"
"30","서대문구","5.09km","3시간","0","3호선","","","진입로 1 : 홍은동 동부센트레빌 버스 정류장(13-122) 일반 567 지선버스 7720<br /> 진입로 2 : 백련사 버스 정류장 마을버스 서대문10 <br />  - 지하철 3호선 홍제역 3번 출구에서 탑승 가능<br /> 진입로 3 : 팔각정 버스 정류장 마을버스 서대문10 <br />  - 지하철 3호선 홍제역 3번 출구에서 탑승 가능<br /> ※교통편의 변경이 있을 수 있으니 출발전 확인 바랍니다.   "," 소공원~은평정"," 숲 속에 들어앉아선 숲을 바라볼 수 없다. 같은 이치로 북한산(836m)을 품에 안으려면 백련산(215m)에 올라야 한다. 백련산은 북한산 반의 반 높이에서도 그 장대함을 한 눈에 담아낼 뿐만 아니라 유순한 산길을 따라 한달음에 능선길이 도달하고 두 걸음에 북한산 조망점에 닿는다.<br /> ※2014년 ‘G마켓, 생명의숲이 함께하는 초록숲길 만들기'사업 대상으로 노선 전체에 초록숲길 안내표지판 설치  ","백련산 나들길(초록숲길)","생태문화길","강북권","중급"
"31","종로구","3.06km","2시간","0","3호선","","","진입로 1 : 도보진입 <br /> 진입로 2 : 세검정 상명대 버스 정류장(01-143) 간선버스 110A, 153 지선버스 1020, 7730  <br /> 진입로 3 : 자하문고개 윤동주시인의언덕 버스 정류장(01-107) 지선버스 7212, 1020, 7022 <br /> - 경복궁역 지하철 3호선 3번 출구에서 약 150m이동 경복궁역 버스정류장(01-116)에서 탑승가능 <br /> ※교통편의 변경이 있을 수 있으니 출발전 확인 바랍니다."," 현통사~백사실계곡~북악산스카이웨이2교~북악산길 산책로"," 돈, 시간, 거리 때문에 여행을 못하시는 분들은 도심 속의 숨은 보석지를 교통카드 한 장을 지참하여 산행할 수 있는 곳이 백사실 두메길이다. 경치가 아주 뛰어난 곳에 붙이는 곳으로 백석동천 이곳을 말한다. 조선 세도가의 별장이 있었던 연못과 버들치 및 원앙, 무당개구리가 서식하는 생태경관보전지역으로 생태탐방의 기회를 얻을 수 있는 곳이다. ","백사실두메 나들길","생태문화길","강북권","중급"
"32","동작구","1.63km","1시간","0","2호선","","","진입로 1 : 도보접근(보라매공원 남문, 신대방역 지하철 2호선 4번 출구) <br /> ※교통편의 변경이 있을 수 있으니 출발전 확인 바랍니다.","보라매공원 호수~인공암벽등반장~보라매공원 후문"," 보라매공원은 서울특별시 동작구 신대방동 395번지 대방로 219 일대인 옛날 공군사관학교 자리를 1985년 12월 20일에 보수하여 1986년 5월 5일 개원하였다. 공군사관학교 때의 상징인 '보라매'를 그대로 이름에 사용하여 오늘에 이르고 있으며, 공원을 산책하는 코스이다.","보라매공원 산책길","생태문화길","강남권","초급"
"33","강서구","2.61km","1시간30분","0","2호선,5호선,9호선","","","진입로 1 : 미주아파트 버스 정류장(16-471) 마을버스 강서03 <br /> 진입로 2~12 : 도보진입 <br /> 진입로 13 : 까치산역 지하철 2, 5호선 1번 출입구 <br /> 진입로 14 : 등촌역 지하철 9호선 8번 출입구 <br /> ※교통편의 변경이 있을 수 있으니 출발전 확인 바랍니다."," 담소터~봉제산배드민턴장~등서초등학교운동장~등촌중학교후문길"," 능선을 따라 걷기 좋은 숲길이 뻗은 봉제산은 산을 위에서 내려다보면 마치 봉황새가 알을 품고 있는 형국이라는 것에서 이름을 얻었다. 산 정상인 매봉은 백제시절에 봉화터였던 까닭에 아직도 봉화터, 봉수대라는 호칭을 사용한다. 해발 117m에 약 1만㎡인 봉제산은 산을 빙 둘러싸고 주택가가 형성되어 있어 찾는 이들도 많고, 진입도 어느 쪽에서나 가능하다. 주능선과 가지능선으로 걷기 편한 산책로가 뻗었으며, 각 능선의 중턱으로도 실핏줄 같은 숲길이 자글자글하다.","봉제산 숲 나들길","생태문화길","강남권","초급"
"34","종로구","4.31km","3시간","0","3호선","","","진입로 1 : 부암동주민센터 버스 정류장(01-139) 지선버스 1020,7022,7212 <br /> - 경복궁역 지하철 3호선 3번 출구에서 약 150m이동 경복궁역 버스정류장(01-116)에서 탑승가능 <br />  ※교통편의 변경이 있을 수 있으니 출발전 확인 바랍니다.  "," 부암동 주민센터~기차바위~만수천약수터~해맞이동산~청운공원"," 창의문에서 시작하여 산행 후 창의문으로 되돌아오는 산행의 강, 약이 혼재하는 원점회귀 코스다. 좁은 골목길로 안평대군 별장, 현진건 집터를 살펴본 후 인왕산 서북능선을 향해 걷다보면 기차바위 정상에 이른다. 기차바위에서는 폭1.5m 길이50m의 구간을 마치 기차 등을 탄 것 같은 기분으로 통과하게 된다. 복원된 성곽길로 만수천 약수터와 새로 단장한 1.8km의 목재 데크 계단, 버드나무체육시설을 가로지르면 청운공원과 목적지인 창의문에 이르게 된다.","부암동 나들길","생태문화길","강북권","중급"
"35","강북구,도봉구","4.71km","2시간","0","4호선","","","진입로 1 : 해모로아파트 버스 정류장 마을 강북05<br />  - 지하철 4호선 미아삼거리역 2번 출구 맞은편에서 강북05 탑승<br /> 진입로 2 : 도보진입 <br /> ※교통편의 변경이 있을 수 있으니 출발전 확인 바랍니다.   "," 경북문화정보센터~삼각산전망대~생태이동로~단풍숲"," 북서울꿈의 숲은 오래전부터 오동근린공원으로 불리던 곳이다. 오동공원은 오패산(123m)과 벽오산(135m)이라는 두 봉우리로 이루어졌는데 오패산은 예부터 오얏나무가 많이 자라 집집마다 울타리로 삼을 정도였다고 전해지며, 벽오산은 이 곳에 오헌이란 고개이름에서 유래된 것으로, 조선시대 철종임금의 비 철인왕후가 손자 김석진에게 벽오산이란 글씨를 하사하여 붙어진 이름이라고 한다. 이 오동공원과 드림랜드가 합쳐진 ‘북서울꿈의 숲’이란 명칭은 한강의 북쪽지역에 있는 대표공원이라는 의미와 놀이시설이었던 드림랜드가 대형녹지공원으로 재탄생된 역사성을 담고 있다.<br /> ※ 북서울 꿈의숲 홈페이지 : http://dreamforest.seoul.go.kr/index.jsp","북서울꿈의숲 나들길","생태문화길","강북권","중급"
"36","강북구,도봉구","2.01km","1시간","0","1호선,6호선","","","진입로 : 도보진입<br />  - 석계역 지하철 1, 6호선 7번 출구에서 마을버스 성북14탑승 후 북서울꿈의숲 정류장에서 하차"," 월영지~월광폭포~창포원~전망대"," 북서울 꿈의 숲은 오래전부터 오동근린공원으로 불리던 곳이다. 이 오동공원과 드림랜드가 합쳐진 ‘북서울 꿈의 숲’이란 명칭은 한강의 북쪽지역에 있는 대표공원이라는 의미와 놀이시설이었던 드림랜드가 대형녹지공원으로 재탄생된 역사성을 담고 있다.  (‘Free course' 로 자유롭게 다닐 수 있도록 조성)<br /> ※ 북서울 꿈의숲 홈페이지 : http://dreamforest.seoul.go.kr/index.jsp","북서울꿈의숲 산책길","생태문화길","강북권","초급"
"37","종로구","6.96km","2시간30분","0","4호선","","","진입로 1 : 한성대입구역 지하철 4호선 6번 출입구 <br />    진입로 2 : 한신113동앞 버스 정류장 마을버스 성북01<br />    진입로 3 : 구민회관201동앞 버스 정류장 마을버스 성북01<br /> - 한성대입구역 6번 출구 삼선교.성북문화원 버스 정류장에서 성북01탑승<br /> ※교통편의 변경이 있을 수 있으니 출발전 확인 바랍니다.           "," 북악스카이웨이 2교~북악팔각정~다모정~하늘한마당~한성대입구역","성북동 산에 번지가 새로 생기면서 / 본래 살던 성북동 비둘기만이 번지가 없어졌다… 김광섭 시인이 성북동 비둘기를 쓴 것이 지난 1968년. 북악스카이웨이가 개통되던 해이다. 비둘기로 상징되는 자연을 깎아서 만든 길, 북악스카이웨이는 자동차만 달렸을 뿐, 사람이 다닐 수 있는 길은 보안상의 이유로 수십 년간 출입이 금지되었다. 그러던 이 길이 2007년 개방됨으로써 산책 명소가 태어나게 되었다.","북악스카이웨이 나들길","생태문화길","강북권","중급"
"38","성북구,종로구","2.79km","2시간","0","3호선","","","진입로 1 : 한성대입구역 지하철 4호선 5번 출입구<br /> ※교통편의 변경이 있을 수 있으니 출발전 확인 바랍니다.   ","한성대입구역 5번 출입구~호경암~숙정문~말바위 안내소~삼청공원"," 서울의 비무장지대라고 불릴 정도로 잘 보존된 숲 사이로 뻗은 산책로를 통해 42년간 금단의 땅이었던 북악산을 만끽할 수 있는 코스이다.<br /> ※창의문 ? 숙정문 ? 말바위 안내소 입장 시 반드시 신분증을 지참해야 한다. <br />  * 어른 : 주민등록증, 운전면허증, 국가유공자증, 공무원증, 여권, 국제운전면허증<br /> * 미성년자 : 보호자 동반하에 입산 가능<br />  * 문의 : 한국문화재보호재단 02-730-9924 ","북악하늘 나들길","생태문화길","강북권","중급"
"39","강북구,도봉구","6.81km","3시간 30분","0","1호선","","","진입로 1 : 도봉역 지하철 1호선 1번 출입구 <br />  - 지하철 1호선 도봉역 1번 출구 맞은편 하천길을 따라 누원교 앞 버스정류장(북서울중학교)에서 마을버스 도봉08탑승 후 버스정류장(무수골)에서 하차 무수골숲길 방향으로 이동하여 진입할 수 있다 <br /> 진입로 2 : 대원그린아파트.도봉실버센터 버스 정류장 마을버스 도봉07<br /> ※교통편의 변경이 있을 수 있으니 출발전 확인 바랍니다.    "," 방학동길 진입로~매표소~자현암~장수텃밭~장수천~쌍둥이전망대"," 도봉역을 출발해 무수골을 걸어 원통사로 가는 길이다. 아무 근심이 없다는 뜻의 무수골에는 주말농장과 성신여대 생활예절교육관인 ‘난향관’이 있다. 이후 약간의 경사로를 따라 숲길을 걸어가면 도선 국사가 창건했다는 원통사가 오밀조밀한 자태를 뽐낸다. 이후 걷게 되는 방학능선에서는 북한산을 바라보며 걸을 수 있어 풍치가 그만이다.","북한산방학 나들길","생태문화길","강북권","중급"
"40","성북구","2.49km","1시간30분","0","4호선","","","진입로 1 : 도보진입<br />  - 지하철 4호선 길음역 7번 출구 마을버스 성북08, 09탑승 후 대우APT211동앞에서 하차 길음초등학교 뒤쪽으로 이동    "," 서경대뒷길~정릉풍림상가~서경대평생교육원"," 길음초등학교 뒤편에서 시작되는 이 숲길은 서경대학교 뒤편을 지나면 성북생태체험관이 나온다. 생태체험관에서는 요일별로 다양한 생태프로그램을 운영하고 있으며 자연학습체험장이 함께 있다. 북한산 칼바위를 향한 북한산 자락길에 접어들면 울창한 잣나무 숲과 계류, 구릉지의 자연부락과 서울도심을 한눈에 감상할 수 있는 숲길이다.","북한산자락 산책길","생태문화길","강북권","초급"
"41","노원구","9.79km","3시간","0","6호선","","","진입로 1 : 효성화운트빌 버스 정류장(11-133) 지선버스 1132, 1143 <br /> - 지하철 6호선 화랑대역 1번 출구 버스 정류장(11-118)에서 지선버스 1132탑승 가능 <br /> - 또는, 화랑대역 4번 출구에서 원자력병원 맞은편으로 도보이동하여 진입할 수 있다<br /> 진입로 2 : 중계본동종점 버스 정류장(11-409) 지선버스 1131, 1141, 1142, 1143, 1221 <br />    진입로 3 : 도보진입 <br /> ※교통편의 변경이 있을 수 있으니 출발전 확인 바랍니다.            "," 회춘샘 약수터~학도암 마애관음보살 좌상~제명호~삼육대 정문"," 수락산과 나란한 불암산은 등산코스로 이름이 높지만 그 언저리로는 그림 같은 숲 산책로가 뻗었다. 또한 가는 길에 불암산 삼육대 생태경관보전지역에 들러 중부지방의 극상수종인 서어나무를 만날 수 있고, 조선 중종의 계비인 문정왕후(文定王后) 윤씨를 모신 태릉에 들어 역사의 향기를 음미할 수도 있다.","불암산 나들길","생태문화길","강북권","중급"
"42","마포구","4.62km","2시간","0","6호선,경의선,공항철도","","","진입로 1 : 디지털미디어시티역 지하철 경의선, 공항철도, 6호선 2번 출구 <br />    진입로 2 : 월드컵경기장역 지하철 6호선 3번 출구 <br /> ※교통편의 변경이 있을 수 있으니 출발전 확인 바랍니다.    "," 상암DMC~상암근린공원~매봉산근린공원"," 이길은 자연과 인간이 함께 하는 길이다. 봄 개나리부터 가을 구절초까지 계절별로 꽃을 피우는 불광천을 지나 월드컵경기장 앞에 서면 규모에 한번, 응원함성 소리에 한번, 두 번 놀라게 된다. 경기장 뒤 매봉산 내 풀무골에서 지명의 유래와 복원된 대장간을 보고 인근 조망점에서 조망겸 잠시 쉬었다가 상암근린공원(상암산)으로 가게 된다. 상암근린공원에는 근래 서울시 보호종인 두꺼비의 이동이 관찰되고 있으며 5월말?6월초 흐린날 운좋으면 두꺼비가 상암산으로 이동하는 모습도 볼 수 있다. 젊음이 어우러진, 발전하는 마포의 모습을 상징적으로 보여주는 상암DMC에서 각기 개성을 뽐내고 있는 특색있는 건축물과 분주히 오가는 사람들의 모습에서 발전하는 대한민국의 모습도 발견할 수 있으며, 목이 마르면 길 중간중간에 위치한 카페(향기카페, 허브북카페)에 들러 차한잔 마시는 즐거움도 누릴수 있는, 또다시 가보고 싶은 재미있는 길이다.","상암산 DMC 체험나들길","생태문화길","강북권","중급"
"43","서초구","3.31km","1시간 30분","0","2호선,3호선,7호선,9호선","","","진입로1 : 고속터미널역 지하철 3, 7, 9호선 5번 출구(또는 3번 출구로 나와 육교를 건너면 서리골 공원으로 바로 진입가능) <br />    진입로2 : 방배역 지하철 2호선 4번 출구 <br />    진입로3 : 도보접근 <br /> ※교통편의 변경이 있을 수 있으니 출발전 확인 바랍니다.            "," 서리골공원~몽마르뜨공원~서리풀공원"," 고층아파트가 스카이라인을 이룬 이곳에 어찌 이리 아름다운 숲길을 허락했을까. 걷는 이들마다 의아해하고, 신기해하고, 끝내는 감사해하는 숲길이다. 이 숲길을 품은 산줄기는 원래 하나였으나 차도가 금을 그으며 생이별을 하고 말았다. 얼마 전까지도 찻길을 건너야만 숲길을 이어갈 수 있었으나 2009년 말 서리골공원과 몽마르뜨공원이 누에다리로 이어지고, 그와 동시에 몽마르뜨공원이 서리풀공원과 서리풀다리로 이어지며 다시 하나의 식구가 됐다.<br />※도심 숲길을 따라 가족과 함께 청명한 가을 하늘을 보며 가볍게 걷기 좋은 길이다.","서리골 서리풀 나들길","생태문화길","강남권","초급"
"44","양천구","0.96km","30분","0","","","","진입로 1 : 서서울호수공원 버스 정류장(15-338) 간선버스 651,652,653,662, 지선버스 6625,6627 <br /> - 지하철 5호선 화곡역 7번 출구 화곡전철역 버스 정류장(16-148)에서 간선버스 652, 653 지선버스 6627탑승 가능 <br /> 진입로 2 : 도보접근 <br /> ※교통편의 변경이 있을 수 있으니 출발전 확인 바랍니다.     "," 서서울 호수공원"," 옛 신월정수장 자리에 꾸며진 서서울공원은 비행기가 지날 때마다 물이 솟구치는 소리분수와 화가 몬드리안의 구성기법을 도입한 몬드리안 정원이 있다.","서서울호수공원 산책길","생태문화길","강남권","초급"
"45","은평구","4.39km","2시간","0","6호선","","","진입로 1 : 시계입구가게앞검문소 버스 정류장(19-442) 간선버스 702A서오릉, 702B용두초교, 광역버스 9701(서오릉 입구 버스 정류장(19-547)에서 바로 진입할 수 있다) <br /> - 지하철 6호선 응암역 2번 출구로 나와 반대방향 우측으로 약 40m 이동 응암역신사오거리 버스 정류장(12-130)에서 702번 탑승 가능 <br /> - 지하철 6호선 구산역 4번 출구로 나와 반대방향 우측으로 약 250m 이동 역촌중앙시장 버스 정류장(12-141)에서 광역버스 9701번 탑승 가능 <br />  진입로 2 : 구산역 지하철 6호선 3번 출입구  <br /> ※교통편의 변경이 있을 수 있으니 출발전 확인 바랍니다."," 수경원~익릉~창릉~홍릉~경릉~순창원"," 서오릉은 사적 제198호로 5릉은 경릉(敬陵)?창릉(昌陵)?익릉(翼陵)?명릉(明陵)?홍릉(弘陵)을 일컫는다. 1457년(세조 3) 세자 장(璋：뒤에 덕종으로 추존됨)이 죽자 이곳에 안장(경릉)한 이래 1470년(성종 1) 덕종의 아우인 예종과 그 계비인 안순왕후 한씨의 창릉, 1681년(숙종 7) 숙종의 비인 인경왕후 김씨의 익릉, 1721년(경종 1) 숙종과 그 계비인 인현왕후 민씨와 제2계비인 인원왕후 김씨의 명릉, 1757년(영조 33) 영조의 비인 정성왕후 서씨의 홍릉이 들어서 능의 무리를 이루었다. 그밖에 이곳에는 명종의 큰아들인 순회세자의 순창원(順昌園)이 경내에 있으며, 1970년에 숙종의 후궁인 희빈 장씨의 대빈묘(大嬪墓)가 이곳으로 이장되었다.<br />  <font color='red'>※휴관일(월요일), 관람요금, 관람시간, 매표시간 등을 문화재청 서오릉 홈페이지에서 확인하실 수 있습니다.</font><br />   ※홈페이지 : http://goyang.cha.go.kr<br /> ※문의전화 : 02-359-0090","서오릉 나들길","생태문화길","강북권","중급"
"46","광진구,성동구","5.22km","2시간","0","2호선,분당선","","","진입로 1 : 서울숲역 지하철 분당선 3번 출구(또는 뚝섬역 지하철 2호선 8번 출구로 나와 서울숲으로 이동) <br />    진입로 2 : 도보진입 <br /> ※교통편의 변경이 있을 수 있으니 출발전 확인 바랍니다.    "," 숲속길~뚝섬가족마당~거울연못~바람의 언덕"," 5개의 테마공원을 갖추고 서울시민들의 웰빙 쉼터로 시민들이 가꾼 자연의 숲.    `Free course` 로 자유롭게 다닐 수 있도록 조성한 코스이다.","서울숲 공원 산책길","생태문화길","강북권","초급"
"47","광진구,성동구","8.82km","3시간30분","0","2호선,분당선","","","진입로 1 : 뚝섬역 지하철 2호선 8번 출입구 <br />    진입로 2 : 서울숲역 지하철 분당선 3번 출입구 <br /> ※교통편의 변경이 있을 수 있으니 출발전 확인 바랍니다.    "," 용비교~응봉공원~독서당공원~금호산~매봉산~서울성곽길"," 서울숲에서 시작하여 응봉공원, 금호산, 매봉산을 거쳐 남산에 이르는 코스이다. 2010년 성동구에서 조성한 산책로로서 곳곳에 안내판이 설치되어 있어 헤메지 않고 쉽게 찾아갈 수 있다. 서울숲은 115만㎡에 5개의 테마공원과 다양한 볼거리를 갖추고 내방객을 기다린다. 응봉공원 전망대에서는 서울숲과 함께 한강 일대가 조망되어 야경 촬영지로도 명성이 높다. <BR /> ","서울숲 남산 나들길","생태문화길","강북권","중급"
"48","송파구","4.17km","1시간","0","2호선,8호선","","","진입로 1 : 잠실역 지하철 2, 8호선 2번 출입구 <br /> 진입로 2 : 잠실역 지하철 2, 8호선 3번 출입구 <br /> 진입로 3 : 석촌역 지하철 8호선 7번 출입구 <br /> ※교통편의 변경이 있을 수 있으니 출발전 확인 바랍니다."," 석촌호수길~석촌동백제초기적성총~방이동백제고분군 "," 석촌호수는 자연과 인간이 힘을 합해 만든 인공호수이다. 원래는 한강의 일부분이었으나, 세월이 흐르면서 샛강이 생겼고 그 후 한강 본류 정비 사업으로 샛강이 매립되면서 인공호수가 생겨나게 되었다. 송파대로 개통으로 둘로 나눠진 이 쌍둥이 호수를 자연친화적 환경으로 정비한 것이 오늘의 석촌호수다. 호수와 인접하여 유명 놀이공원이 만들어져 있어 여러모로 볼거리와 즐길거리가 많다. ","석촌호수 산책길","생태문화길","강남권","초급"
"49","강남구","4.15km","2시간","0","2호선,분당선","","","진입로 1 :  삼성역 지하철 2호선 6번 출구 <br />    진입로 2 :  선릉역 지하철 분당선, 2호선 8번 출구 <br /> ※교통편의 변경이 있을 수 있으니 출발전 확인 바랍니다."," 대웅전~미륵대불~선릉외각길~매표소~정릉~전현왕후릉~선릉"," 2009년 6월에 유네스코 세계문화유산으로 등재된 조선 왕릉의 하나인 선정릉을 거쳐 전통사찰인 봉은사를 지나는 코스이다. 조선 제 9대 왕인 성종과 계비 정현왕후의 능인 선릉과 함께 조선 11대 왕인 중종의 능이 모셔진 곳으로 이 두 능침 사이로 나 있는 야트막한 언덕으로 걷기 좋은 산책로가 세 가닥이나 뻗었다. 봉은사 역시 볼만한 전각들이 많으며, 특히 미륵대불은 언제나 소원을 빌러 오는 신자들로 붐빈다. <br /> <font color='red'>※휴관일(월요일), 관람요금, 관람시간, 매표시간 등을 문화재청 정릉 홈페이지에서 확인하실 수 있습니다.</font><br />   ※홈페이지 : http://seonjeong.cha.go.kr<br /> ※문의전화 : 02-568-1291   ","선정릉나들길","생태문화길","강남권","중급"
"50","광진구,성동구","2.93㎞","1시간30분","0","2호선,5호선,7호선","","","출 발 지 : 군자역 지하철 5호선, 7호선 8번 출입구 <br />    도 착 지 : 한양대역 지하철 2호선 3번 출구 <br /> ※교통편의 변경이 있을 수 있으니 출발전 확인 바랍니다.   "," 아차산역~어린이대공원~송정동 둑길~살곶이다리~응봉역","무료로 개방되는 어린이대공원을 후문으로 들어가 한 바퀴 돈 후 정문으로 나가게 된다. 이름 그대로 아이들과 함께 가도 아주 좋을만한 코스이다. 이후 군자교 부근에서 시작되는 송정동 둑길을 지난다. 옆으로 동부간선도로를 달리는 자동차 소리가 들리기는 하지만 높이 솟은 가로수들이 시원한 그늘을 드리우고 있어 한여름에도 걷기가 나쁘지 않다. 또한 중반 무렵 화장실 왼쪽으로 시작되는 은행나무길은 울창한 숲 속에 들어와 있는 착각마저 불러일으킨다. 이후 조선시대에 가장 긴 다리였다는 살곶이다리를 건너 중랑천길을 잠시 걸어 응봉역으로 진입한다. ","성동 송정둑길","생태문화길","강북권","초급"
