"순번","자치구","거리","소요시간","추천수","연계지하철역","연계코스","연계공원","교통편","상세코스","설명","코스명","코스대분류","강남강북구분","코스레벨"
"51","성북구","4.16km","2시간","0","4호선","","","진입로 1 : 한성대입구역 지하철 4호선 5번 출입구 <br /> ※교통편의 변경이 있을 수 있으니 출발전 확인 바랍니다.   "," 길상사~심우장~수연산방"," 600년 도성의 성곽을 사이에 두고 오랜 세월을 견디어낸 성북동 고택과 북촌한옥마을의 고색창연한 길이다. 이 조선 역사의 길에는 법정 스님의 맑은 향이 영원히 가시지 않을 것 같은 길상사를 비롯해 만해 한용운 선생이 말년을 보낸 심우장, 시민기금으로 매입하여 보존하고 있는 최순우 옛집 등이 지나는 나그네들을 따스한 손길로 맞아들인다. 지금의 서울을 그윽하게 조망하게 하여 온고지신의 의미를 되새기는 시간을 만든다. <br /> ※옛 보물지도를 따라 걷는듯한 길이다. 성북동의 소박한 옛길은 걷는 이들에게 따스함과 맑고 향기로움을 온 몸 가득 느낄 수 있게 해주는 괜찮은 가을 소풍코스이다.","성북동고택북촌산책길","생태문화길","강북권","중급"
"52","송파구","30.21km","8시간","0","2호선,5호선,8호선","","","진입로 1 : 잠실역 지하철 2호선, 8호선 3번 출구 <br /> 진입로 2 : 잠실나루역 지하철 2호선 1번 출구 <br />      진입로 3 : 올림픽공원남2문 버스 정류장(24-240) 일반 30, 30-5, 지선버스 3412, 3413 <br />      진입로 4 : 올림픽공원역 지하철 5호선 1번 출구 <br />      진입로 5 : 도보진입  <br /> ※교통편의 변경이 있을 수 있으니 출발전 확인 바랍니다.","석촌호수길~한성백제박물관~몽촌토성~양재천 산책로","석촌호수를 출발하여 송파구를 흐르는 한강~탄천 등 송파구를 걷는 장거리 코스이다. 송파소리길을 안내하는 홈페이지가 있고, 매년 걷기 행사 등이 열려 주민들의 많은 참여가 이루어지는 코스이다.<br />       ※ 홈페이지 : http://sorigil.songpa.go.kr","송파소리길","생태문화길","강남권","고급"
"53","노원구","7.39km","4시간30분","0","7호선","","","진입로 1 : 수락산역 지하철 7호선 3번 출입구 <br />    진입로 2 : 수락산 입구 교차로  <br />  ※교통편의 변경이 있을 수 있으니 출발전 확인 바랍니다.   "," 암불사~도솔봉~수락산정상"," 수락산은 해발 637m로 남쪽으로 불암산과 연결되어 노원구 상계동과 의정부시, 남양주시의 경계를 이루고 있다. 수락산 능선상에 있는 암봉들은 서울을 향해서 고개를 숙이고 있는 형국으로 태조 이성계는 서울의 수호산이라고 하였다. 수락산의 명칭은 내원암 일대 계곡에 바위가 벽을 이루고 있어 물이 굴러 떨어지므로 수락이라고 하였다는 설과 골짜기 물이 맑아 금류, 은류, 옥류라는 폭포를 이루어 떨어지는 자태에 이름이 붙여졌다는 전설도 있다. 대부분 돌산으로 화강암의 암벽이 노출되어 있지만 산세는 험하지 않으며 수각계곡과 노원골 일대 1km 산책로는 삼림욕을 하기에 아주 놓은 곳이다. 주말이면 도심에서 몰려온 산악인들로 항상 붐비는 산이며 북한산, 도봉산, 관악산과 함께 서울 근교의 4대 명산으로 불린다.<br />    ※ 2012년‘G마켓, 생명의숲과 함께하는 아름다운 숲길 가꾸기’사업 대상 노선으로 노선 전체에 초록숲길 안내표지판 설치 ","수락산 나들길(초록숲길)","생태문화길","강북권","고급"
"54","서대문구","6.14km","2시간30분","0","2호선,6호선","","","진입로 1 : 대흥역 지하철 6호선 1번 출입구 <br />    진입로 2 : 신촌역 지하철 2호선 3번 출입구 <br /> ※교통편의 변경이 있을 수 있으니 출발전 확인 바랍니다. ","서강대정문~노고산~이대정문~연세대동문","신촌은 대학촌이다. 대학은 학문의 광장이지만 넓고 활기찬 캠퍼스는 도시민들의 공원역할도 마다 않는다. 상록의 물결이 가득한 신촌의 3개 대학, 서강대-이화여대-연세대캠퍼스 산책로를 연결하면 색다른 걷기 코스가 된다. 세 대학은 각기 다른 개성과 분위기를 풍겨 걷는 재미 또한 독특하다. 차분한 서강대에서 활기 넘치는 이화여대로, 그리고 호젓한 연세대의 숲길을 걸어 신촌으로 돌아 나오는 코스는 가족 나들이나 연인들의 데이트 코스로도 안성맞춤이다.","신촌대학탐방 나들길","생태문화길","강북권","중급"
"55","강북구,도봉구","5.21km","2시간 30분","0","1호선,4호선","","","진입로 1 : 신한은행방학동지점 버스 정류장(10-194) 간선버스 130 지선버스 1119, 1144, 1161 <br /> - 지하철 1, 4호선 창동역 1번 출구 창동역동측도보방면 버스 정류장(10-266)에서 지선버스 1161번 탑승 가능 <br />   진입로 2 : 도봉구민회관 버스 정류장(10-013) 일반 36, 133, 37, 118, 74, 72 간선버스 101, 106, 107, 130, 140, 141, 142, 150, 160, 108 <br /> ※교통편의 변경이 있을 수 있으니 출발전 확인 바랍니다.   "," 발바닥공원~정자쉼터~쌍문근린공원~벚나무길"," 쌍문 역사 탐방길은 지나는 발자국 곳곳에 과거 우리의 역사와 문화를 떠올리게 만드는 공간이다. 1960년 형성된 판자촌에 조성한 발바닥 공원, 그리고 연산군과 정의공주의 묘, 원당샘과 천년 은행나무 등 곳곳에 숨어있는 우리의 역사와 문화를 체험할 수 있다. <br /> ※ 2013년‘G마켓, 생명의숲과 함께하는 초록숲길 만들기’사업 대상 노선으로 노선 전체에 초록숲길 안내표지판 설치  ","쌍문역사 산책길(초록숲길)","생태문화길","강북권","중급"
"56","광진구,성동구","2.78km","3시간","0","5호선","","","진입로 1 : 도보진입(동의초등학교) <br /> - 아차산역 지하철 5호선 2번 출구에서 도보로 이동(약 1km)하여 동의초등학교로 갈 수 있다<br /> ※교통편의 변경이 있을 수 있으니 출발전 확인 바랍니다.   "," 만남의 광장~소나무림~아차산성~아차산성 유원지~오동나무 자생지"," 서울 한강 북쪽의 아차산은 아끼산 아계산으로도 불린다. 고구려 장군 온달이 신라군과 싸우다 전사했다는 이야기도 전해 내려오며 능선에서는 한강 유역을 한 눈에 내려다 볼 수 있어 예전부터 군사적 요충지로 손꼽힌다. <br />※가을이면 아차산 능선에서 보이는 한강 둔치에 코스모스 물결이 장관이다. 또한 산은 낮아도 주변 일대가 평지라 정상에서 보이는 한강과 어우러진 도심의 야경은 탄성을 자아내기에 충분하다. ","아차산 숲 나들길","생태문화길","강북권","고급"
"57","서대문구","2.23km","3시간","0","3호선","","","진입로 1 : 서대문구청 서대문보건소 버스 정류장(13-156) 간선버스 110A,153 지선버스 7017,7713,7720,7738,8774 <br /> ※서대문구청 뒤편으로 이동하여 진입할 수 있다<br /> - 지하철 3호선 홍제역 3번 출구 홍제역 버스 정류장(13-125)에서 지선버스 7713, 7738탑승 가능<br />   진입로 2 : 무악재역 지하철 3호선 3번 출입구  <br /> ※교통편의 변경이 있을 수 있으니 출발전 확인 바랍니다. <br />   "," 메타세콰이어 숲~방크스소나무 숲~단풍나무길~벚나무 길~무학정"," 안산은 해발 296m로 동봉과 서봉의 두 봉우리로 이루어져, 산의 모양이 마치 말의 안장 즉 길마와 같이 생겨 붙여진 이름으로, 인왕산에서 서쪽으로 비스듬히 뻗어 무악재를 이루고 있는 산이다.<br />  ※2014년 ‘G마켓, 생명의숲이 함께하는 초록숲길 만들기'사업 대상으로 노선 전체에 초록숲길 안내표지판 설치 ","안산숲 나들길(초록숲길)","생태문화길","강북권","초급"
"58","광진구,성동구","1.89km","2시간","0","5호선,7호선","","","진입로 1 : 아차산역 지하철 5호선 4번 출입구 <br />    진입로 2 : 어린이대공원역 지하철 7호선 6번 출입구 <br /> ※교통편의 변경이 있을 수 있으니 출발전 확인 바랍니다.   "," 모험의 나라 놀이터~음악분수~전래동화마을~물놀이장"," 53만여㎡의 넓은 공간속에 동물원, 식물원, 놀이동산 및 다양한 공연시설과 체험공간이 가득한 어린이 가족테마공원이다.    (`Free course` 로 자유롭게 다닐 수 있도록 조성)","어린이대공원 산책길","생태문화길","강북권","초급"
"59","영등포구","2.82km","1시간30분","0","5호선,9호선","","","진입로 1 : 국회의사당역 지하철 9호선 3번 출구 <br />    진입로 2 : 여의도역 지하철 5, 9호선 3번 출구 <br /> ※교통편의 변경이 있을 수 있으니 출발전 확인 바랍니다.   "," 여의도공원 역~ 여의도공원 광장 여의도샛강생태공원","친수공간으로 연출된 생태공원과 옛 여의도광장과 여의도공원은 지하철, 버스 등 대중교통으로 접근성이 좋아 직장인과 일반시민들이 즐겨 찾는 명소이자 봄꽃축제, 세계불꽃축제, 각종 공연 및 마라톤행사 등 다양한 행사가 이어져 볼거리와 즐길거리가 풍부한 휴식공간입니다.    (`Free course` 로 자유롭게 다닐 수 있도록 조성)","여의도공원 산책길","생태문화길","강남권","초급"
"60","영등포구","3.84km","1시간30분","0","2호선,7호선","","","진입로 1 : 도림천역 지하철 2호선 2번 출구 <br />    진입로 2 : 신풍역 지하철 7호선 2번 출구 <br /> ※교통편의 변경이 있을 수 있으니 출발전 확인 바랍니다.   "," 도림천역~신도림역~신길공원~신길동 넝쿨장미길~신풍역"," 신풍역 주변 신길6동 벚꽃길에서 시작하는 이 길은 주민들이 직접 헌수하여 조성한 왕벚나무, 넝쿨장미길을 지나 대방천 수림대(가로녹지)로 연결되는 도심 내 건강 산책길이다. 신길6동 벚꽃길과 신길동 넝쿨장미길을 지나 꽃섬길 마을마당(신길광장공원), 대방천 가로녹지대, 도림천으로 연결되는 코스는 지역축제 개최 및 다양한 경관이 펼쳐지며, 휴게시설 및 야외 체육시설이 설치되어 있어 휴식과 운동을 병행하는 재미를 안긴다.","영등포 봄꽃 나들길","생태문화길","강남권","초급"
"61","성북구","2.02km","1시간","0","6호선","","","진입로 1 : 상월곡역 지하철 6호선 1번 출입구 <br /> - 1번 출구 반대방향으로 우남아파트와 월곡중학교 사이길을 통해 월곡초등학교쪽으로 이동하여 오동공원 진입<br />   진입로 2 : 도보진입 <br /> ※교통편의 변경이 있을 수 있으니 출발전 확인 바랍니다.   ","오동공원"," 1987년 4월 27일 시민근린공원으로 지정되었다. 서울 강북구 번동?미아동 등의 5개 동과 성북구 월곡동에 걸쳐 있는 대단위공원으로 면적이 138만 2,260㎡에 이른다. 공원에 오르면 북한산?도봉산?수락산?불암산이 병풍처럼 둘러쳐 있고 배드민턴장?운동장?체력단련시설?산책로?잔디밭 등과 함께 울창한 숲이 조성되어 있다. 특히 ‘꽃샘길’로 불리는 길이 400m 구간은 한 시민이 정성을 다해 꽃과 나무를 가꾸는 것으로 유명하다. 공원 산자락에는 북서울 꿈의 숲이 조성되어 있다. ","오동공원 산책길","생태문화길","강북권","초급"
"62","강북구,도봉구","2.06km","1시간","0","4호선","","","진입로 1 : 미아역 지하철 4호선 2번 출입구 <br />    진입로 2 : 강북구민운동장.4단지 버스 정류장 마을버스 강북09, 11 <br />    진입로 3 : 번동한솔솔파크 버스 정류장(09-232) 지선버스 1124 <br />    진입로 4 : 도보진입  <br /> ※교통편의 변경이 있을 수 있으니 출발전 확인 바랍니다.   "," 오동공원~꽃샘길~율곡놀이터~신망애정자"," 오패산은 강북구의 미아동과 번동, 성북구의 장위동, 월곡동에 위치해 있고, 도시주거지 한복판에 있으면서도 자연상태가 잘 보존된 편이다. 일명 빡빡산(?), 매봉산 등으로도 불린다. 123m의 오패산과 115m 봉우리, 그리고 135m의 벽오산 봉우리로 이루어져 있다. 기슭에는 예부터 오얏나무가 많이 자생하여 봄이 되면 수려한 오얏나무 꽃이 만발하다.","오패산 나들길","생태문화길","강북권","중급"
"63","중랑구","4.02km","2시간","0","7호선","","","진입로 1 : 용마산역 지하철 7호선 2번 출구  <br />    진입로 2 : 용마한신아파트 버스 정류장(07-201) 일반 70 간선버스 320 지선버스 2012  <br />  ※교통편의 변경이 있을 수 있으니 출발전 확인 바랍니다.   "," 용마폭포공원~용마산 우수조망명소~깔딱고개~사가정공원"," 동양 최대의 인공폭포인 용마폭포공원에서 시작하여, 용마산의 수수하고 차분한 숲길을 걸어보는 즐거움이 있는 노선이다. 해발 287m의 용마산은 오르기 어렵지 않고 편안한 산행을 약속한다. 용마산 숲길을 지나 조선 시대의 문신 서거정의 시 4편이 새겨져있는 사가정공원에 이르러 시 한수와 함께 조금은 힘들었던 산행을 마무리할 수 있다.","용마산 나들길","생태문화길","강북권","고급"
"64","용산구,중구","3.30km","1시간","0","4호선,중앙선","","","진입로 1 : 이촌역 지하철 중앙선, 4호선 2번 출구 <br /> ※교통편의 변경이 있을 수 있으니 출발전 확인 바랍니다.   "," 국립중앙박물관~거울못~용산가족공원~보신각종"," 한국 최대 박물관인 국립중앙박물관을 거쳐 도심 속의 녹색쉼터 용산가족공원을 탐방하는 코스이다. ","용산가족 산책길","생태문화길","강북권","중급"
"65","양천구","2.63km","1시간30분","0","5호선,9호선","","","진입로 1 : 용왕산입구 버스 정류장 마을버스 양천02 <br /> - 지하철 5호선 오목교역 1번 출구 오목교역.대학학원 버스 정류장에서 마을버스 양천02 탑승 가능 <br />     진입로 2 : 신목동역 지하철 9호선 1번출구 <br /> ※교통편의 변경이 있을 수 있으니 출발전 확인 바랍니다.     ","용왕산 진입로~용왕정~달거리약수터"," 1971년 8월 건설부고시에 의하여 목동 제1공원으로 지정되었다. 이후 1989년에 도시근린공원으로 개발되었다. 야산에 위치하여 시민들의 휴식공간으로 활용된다. 3코스의 산책로가 조성되어 있으며, 공원 내에는 1997년 5월 완공한 목동종합사회복지관이 들어서 있다. 연간 12만 명이 찾는다.","용왕산 나들길","생태문화길","강남권","초급"
"66","서초구","3.86km","2시간","0","3호선","","","진입로 : 남부터미널역 지하철 3호선 4번 출구 <br /> ※교통편의 변경이 있을 수 있으니 출발전 확인 바랍니다."," 남부터미널역~소망탑 전망대","우면산은 서초구의 가장 대표적인 산으로 다양한 편의시설과 약수터가 중턱과 능선, 진입로의 요소요소에 잘 구비되어 있어 걷기 환경이 매우 좋다. 우면산 정상이라 할 수 있는 소망탑 전망대에서는 서울이 한 눈에 내려다보이는 장관을 만끽할 수 있다.","우면산 나들길","생태문화길","강남권","중급"
"67","강북구,도봉구","7.95km","2시간30분","0","1호선,4호선","","","진입로 1 : 우이동도선사입구 버스 정류장(09-101) 간선버스 130 지선버스 1161 <br /> - 지하철 4호선 쌍문역 2번 출구 버스 정류장 쌍문역(10-016)에서 간선 130번 탑승 가능 <br /> - 지하철 1, 4호선 창동역 1번 출구 버스 정류장 창동역동측도봉방면(10-266)에서 지선 1161번 탑승 가능 <br /> 진입로 2 : 우이령 오봉산석굴암입구 버스 정류장(39-137) 일반 34 간선버스 704 <br /> ※교통편의 변경이 있을 수 있으니 출발전 확인 바랍니다.   "," 방문자서비스센터~소귀고개 정상~오봉전망대~석굴암","우이령 길은 서울 우이동과 경기도 양주시를 연결하는 6.8km의 소로였으나. 1968년 1.21사태 당시 무장공비 침투로로 이용된 후 안보상의 이유로 폐쇄되었다가, 결국 2009년 7월 10일에 탐방객 수를 제한하는 조건으로 우이령이 재개방되었다. 특히 우이령 구간은 맨발로 걸을 수 있도록 정비되어 자연을 마음껏 느낄 수 있다.<br /> ※ 매일 1,000명에게만 개방을 하며 사전예약을 해야 탐방이 가능하다. 입장은 무료이지만 출입시간은 오전09시부터 오후02시까지다.<br /> ※ 사전예약 홈페이지 : <a href = 'http://reservation.knps.or.kr/information/trailInfo.action?trailCd=2'>http://reservation.knps.or.kr/information/trailInfo.action?trailCd=2</a>","우이령 나들길","생태문화길","강북권","중급"
"68","강서구","2.51km","1시간 50분","0","5호선","","","진입로 1 : 우장산역 지하철 5호선 1번 출입구 <br /> ※교통편의 변경이 있을 수 있으니 출발전 확인 바랍니다."," 우장상공원 출입구~우장산생태육교~한국폴리텍대학앞"," 우장산공원의 두 봉우리 중 새마을탑이 서 있는 북동쪽을 검두산, 서남쪽의 폴리텍대학이 있는 산을 원당산이라고 부르며, 이 두 곳을 합쳐 우장산이라고 부른다. 이 이름의 유래는 옛날 가뭄이 들었을 때 양천 현감이 이곳에서 기우제를 올린 것에서 유래한다. 공원 외곽으로는 남산순환산책로를 연상시키는 포장산책로가 잘 나 있으며, 봉우리 부근으로는 숲 속으로 난 흙길 산책로가 거미줄처럼 뻗었다.","우장산 공원 산책길","생태문화길","강남권","초급"
"69","노원구","1.12km","1시간","0","1호선","","","진입로 1 : 인덕삼거리 버스 정류장(11-331) 간선버스 163 지선버스 1017, 1130, 1133, 1137, 1140  <br /> - 지하철 1호선 월계역 3번 출구에서 월계근린공원으로 이동 가능(약 500m) <br /> 진입로 2 : 월계삼거리 버스 정류장(11-286) 간선버스 261 지선버스 1017, 1137 <br />  ※교통편의 변경이 있을 수 있으니 출발전 확인 바랍니다.   "," 체력장"," 아기자기한 오솔길이 얽혀있어 걷기 좋은 근린공원이다. (무단경작지가 들어서 있는 영축산근린공원은 도심텃밭과 목공, 염색체험을 할 수 있도록 조성방안 검토 중)","월계근린공원 산책길","생태문화길","강북권","초급"
"70","마포구","19.29km","4시간30분","0","6호선","","","진입로 1 : 월드컵경기장역 지하철 6호선 3번 출입구 <br />    진입로 2 : 월드컵경기장역 지하철 6호선 2번 출입구 <br />  ※교통편의 변경이 있을 수 있으니 출발전 확인 바랍니다.   ","매봉산입구~난지천공원~노을공원~메타세콰이어길~하늘공원~평화의공원","2002 월드컵 함성이 그리운 월드컵공원 주변에는 뜻밖의 볼거리들이 많다. 크게 알려지지 않은 매봉산에서부터 이제는 서울의 명소가 된 하늘공원과 메타세콰이어 산책로까지 멋진 길이 이어진다. 짧지 않은 거리지만 구간이 바뀔 때마다 새로운 풍광이 펼쳐져 지루하지 않고, 구간 구간마다 회귀로가 열려 있어 체력에 따른 거리조절도 얼마든지 가능하다.<br />※평지나 다름없는 공원들은 초보자들도 쉽게 걸을 수 있다. 난지천의 생태공원, 하늘과 가장 가깝다는 하늘공원 등 다양한 테마의 공원들은 특색 있는 볼거리와 산책길을 제공한다. 가을 노을이 가장 아픔답다는 노을 공원은 해질 무렵 연인들의 데이트 코스와 노을 촬영지로도 유명한 코스이다.","월드컵공원 나들길","생태문화길","강북권","고급"
"71","종로구","8.12km","2시간","0","1호선,3호선,5호선","","","진입로 1 : 종로3가역 지하철 1, 3, 5호선 1번 출입구 <br />    진입로 2 : 경복궁역 지하철 3호선 5번 출입구 <br />    진입로 3 : 안국역 지하철 3호선 2번 출입구 <br /> ※교통편의 변경이 있을 수 있으니 출발전 확인 바랍니다.           "," 인사동 네거리~경복궁매표소~청와대분수앞~북촌한옥마을길","서울 도심에서 맛볼 수 있는 역사와 문화가 고르게 어우러진 코스이다. 경복궁 내부의 여러 전각을 둘러보고 고풍스런 담장길을 따라 걷다 푸른 기와가 상징처럼 알려진 청와대의 앞길을 걸어 삼청동 카페길에 다다른다. 이후 서울성곽까지도 갈 수 있는 삼청공원을 산책한 후 서울에서 가장 한옥이 잘 보존되어 있다는 북촌한옥마을의 고즈넉한 길을 밟는다. 서울 도심에 이런 역사와 문화가 깃든 길이 있다는 것이 내내 감사할 따름이다.","인사동삼청동 나들길","생태문화길","강북권","중급"
"72","종로구","3.54km","1시간 30분","0","3호선","","","진입로 1 : 경복궁역 지하철 3호선 1번 출입구 <br />    진입로 2 : 도보진입(통일로 18나길)  <br /> ※교통편의 변경이 있을 수 있으니 출발전 확인 바랍니다.   "," 단군성전~인왕스카이웨이 산책로~만수천약수터~범바위기점"," 단군성전과 소공원 길을 거쳐 성 외곽 길을 걷다보면 초입부터 바위틈에 자라는 소나무와 바위가 잘 어우러져 다양한 형상의 기암괴석을 만나게 된다. 돼지바위에서 조망은 독립문과 서대문형무소역사박물관, 독립공원 전체를 한눈에 볼 수 있다. 이른 봄 무악공원 주변에는 천상화원으로 개나리군락과 산수유 꽃의 노랑물결로 환상적인 분위기를 느낄 수 있다. ","인왕산 나들길","생태문화길","강북권","중급"
"73","강동구","5.21km","3시간","0","5호선","","","진입로 1 : 일자산입구 버스 정류장(25-185) 간선버스 351 <br /> - 지하철 5호선 강동역 4번 출구 강동역(동신중학교) 버스 정류장(25-126)에서 간선버스 351번 탑승 가능 <br /> ※교통편의 변경이 있을 수 있으니 출발전 확인 바랍니다.","길동자연생태공원~강동그린웨이 가족캠핑장~둔촌이집선생 둔굴"," 노선의 대부분은 차지하는 일자산은 이름 그대로 능선이 군더더기 없이 일(一)자로 뻗은 산이다. 때문에 중간 중간 갈림길이 많아도 큰 길을 따라 곧장 질러가면 3㎞에 달하는 울창한 숲길을 고스란히 두 발에 담아낼 수 있다. 특히 아름드리나무들이 많아 마치 큰 산에 들어선 듯한 청량감이 일품이다. 강동구가 야심차게 추진하고 있는 강동그린웨이를 중심으로 둔촌동 생태경관보전지역, 허브천문공원 및 길동생태공원 등 강동의 주요 명소를 연결한 코스이다. 야트막한 능선으로 뻗은 일자산 숲길을 따라 자연의 향기를 만끽할 수 있으며,  길동생태공원(사전예약 필수)은 우리나라의 대표적인 생태공원으로 계절별로 다양한 체험 프로그램이 마련되어 있다.<br />※봄이면 꽃향기가 가득한 허브천문공원, 그리고 동?식물의 모습을 관찰 할 수 있는 길동생태공원 등을 돌아보는 볼거리 등 아이들과 무리 없이 즐길 수 있는 요소들을 많이 포함한 가족 맞춤형 코스이다.","일자산 숲 나들길","생태문화길","강남권","중급"
"74","용산구,중구","1.63km","40분","0","4호선,6호선","","","진입로 1 : 삼각지역 지하철 4, 6호선 3번 출구(또는 삼각지역 12번 출구에서 전쟁기념관으로 바로 진입)  <br />  ※교통편의 변경이 있을 수 있으니 출발전 확인 바랍니다.   "," 옥외전시장~전사자영비"," 호국 자료의 수집?보존?전시, 전쟁의 교훈과 호국정신 배양, 선열들의 호국 위훈 추모를 목적으로 1990년 9월 착공해 1993년 12월 완공하고, 1994년 6월 10일 개관한 기념관이다. 연건평 2만 5천 평에 지하 2층, 지상 4층 규모이며, 호국추모실?전쟁역사실?한국전쟁실?해외파병실?국군발전실?대형장비실 등 6개 전시실로 구분되어 있는 전쟁기념관과 옥외에 조성된 공원을 둘러보며 역사를 되새길 수 있는 코스이다.","전쟁기념관 산책길","생태문화길","강북권","초급"
