"순번","자치구","거리","소요시간","추천수","연계지하철역","연계코스","연계공원","교통편","상세코스","설명","코스명","코스대분류","강남강북구분","코스레벨"
"75","성북구","2.23km","1시간30분","0","4호선","","","진입로 1 : 산장빌라 버스 정류장(08-357) 지선버스 1162 <br /> - 지하철 4호선 성신여대입구역 6번 출구 성신여대입구 버스 정류장(08-270)에서 지선버스 1162번 탑승 가능 <br /> ※교통편의 변경이 있을 수 있으니 출발전 확인 바랍니다.   "," 정릉 매표소~홍살문~정자각~비각~정릉"," 한성대입구역에서 북악스카이웨이를 넘어가는 이 길은 태조 이성계의 계비인 신덕왕후 강씨를 모신 정릉으로 가는 길이다. 신덕왕후 강씨에 대한 미움이 대단했던 태종이 후에 옮겨 온 능이지만 능 주변으로는 걷기 좋은 산책로가 옹골차게 뿌려져 있다. 산책로 곳곳엔 시원한 약수터와 물이 졸졸 흐르는 작은 계곡도 있다. 성북 구민회관부터 북악스카이웨이 입구까지는 메타세콰이어나무가 시원한 그늘을 드리우고 있다. <br />※숨겨진 보물 같은 정릉숲길에 들어서면 울창한 참나무와 소나무가 우거져 주택가 안쪽에 있는 길이라고는 믿기지 않을 만큼 도시의 소음은 어느새 멀어지고 새소리 물소리에 청량감이 전해져 온다. 잘 조성된 정릉 내 산책로는 작은 계곡과 약수터를 자주 만날 수 있으며, 어린아이뿐만 아니라 누구나 편안하게 걸을 수 있어 가을에 가족들이 가볍게 걷기에 적합하다.<br />  <font color='red'>※휴관일(월요일), 관람요금, 관람시간, 매표시간 등을 문화재청 정릉 홈페이지에서 확인하실 수 있습니다.</font><br />   ※홈페이지 : http://seoul.cha.go.kr<br /> ※문의전화 : 02-914-5133","정릉숲 산책길","생태문화길","강북권","초급"
"76","중랑구","5.68km","2시간","0","6호선,7호선","","","진입로 1 : 태릉입구역 지하철 6, 7호선 8번 출구 <br />    진입로 2 : 사가정역 지하철 7호선 3번 출구 <br /> ※교통편의 변경이 있을 수 있으니 출발전 확인 바랍니다.   "," 사각문~묵동수림공원~수림대장미원"," 중랑천제방은 이렇다 할 공원ㆍ녹지공간이 없는 중랑천 일대의 주민들에게 휴식과 운동, 여가를 제공해주는 중요한 코스이다.","중랑천제방장미 벚꽃길","생태문화길","강북권","초급"
"77","중랑구","3.73km","2시간","0","중앙선","","","진입로 : 양원역 지하철 중앙선 2번 출구 <br />  ※교통편의 변경이 있을 수 있으니 출발전 확인 바랍니다.     "," 중랑캠핑숲입구~망우산공원입구~나들이공원"," 개발제한구역 내 비닐하우스 등으로 훼손된 곳을 복원하여 학생소풍 및 가족단위 피크닉을 주제로 한 체험공원입니다. 인위적 시설을 최소화하였으며, 건강한 숲을 주제로 한 생태학습 공원입니다. 또한 소규모 야외무대 설치 등 청소년 중심의 문화중심 공원으로 조성되었다. ","중랑캠핑숲나들길","생태문화길","강북권","중급"
"78","은평구","2.76km","1시간","0","3호선","","","진입로 1 : 구파발역 지하철 3호선 1번 출입구 <br />    진입로 2 : 도보진입(우물골 두산위브 7단지) <br />  진입로 3 : 도보진입(서울둘레길 연계) <br /> ※교통편의 변경이 있을 수 있으니 출발전 확인 바랍니다.   "," 구파발역 1번 출입구~진관공원 전파기지국~진관초 방향 내리막길~정자"," 귀모양을 닮았다 하여 붙여진 이(耳)말산에 위치한 진관공원은 진행 중인 은평뉴타운 내 주민들의 산책로로 이용되고 있는 진관공원은 은평뉴타운 및 북한산의 파노라믹한 우수한 경관이 한눈에 들어와 뉴타운사업 완료시 이용객의 수요 증가를 예상할 수 있다.","진관공원 나들길","생태문화길","강북권","초급"
"79","성북구","2.23km","1시간","0","6호선","","","진입로 1 : 상월곡역 지하철 6호선 4번 출입구 <br />    진입로 2 : 도보진입 <br /> ※교통편의 변경이 있을 수 있으니 출발전 확인 바랍니다.   ","천장산 전망대"," 천장산은 문화적 가치가 높은 사적 204호인 조선 왕릉인 의릉과 도심에서는 보기 드문 울창한 자연림을 볼 수 있는 길이다.","천장산 산책길","생태문화길","강북권","초급"
"80","관악구,금천구","5.87km","1시간 50분","0","2호선","","","진입로 1 : 서울대입구역 지하철 2호선 3번 출구 <br /> ※교통편의 변경이 있을 수 있으니 출발전 확인 바랍니다.   ","청룡산 공원~누수식 생태연못~청룡상 산림욕장","청룡산은 서울대입구역과 서울대정문 사이에 위치한 조그마한 산으로 주택과 인접하고 있어 간단히 산책을 즐길 수 있는 곳으로 계곡물을 이용 많은 습지가 조성되어 있다. <br /> ※경사가 완만하고 물이 풍부하여 생태연못 및 유아숲체험장이 조성되어 특히 봄에 아이들과 천천히 거닐며 자연생태를 관찰 할 수 있다.","청룡산 나들길","생태문화길","강남권","초급"
"81","노원구,도봉구","4.59km","1시간30분","0","1호선","","","진입로 1 : 녹천역 지하철 1호선 4번 출구  <br />    진입로 2 : 도보진입 <br />    진입로 3 : 인덕대학교 버스정류장(11-309) 지선 1130, 1133, 1161<br />  ※교통편의 변경이 있을 수 있으니 출발전 확인 바랍니다.               "," 산사나무 군락지"," 초안산은 아주 작은 산이지만, 면적에 비해서 믿기지 않을 정도의 아기자기한 길이 고루 퍼져있다. 조선시대 내시들의 묘가 많아 ‘내시네 산’이라고도 불렸는데, 조선시대의 분묘가 무려 1,000여기나 산재해 있다. 한국 전쟁 때 국군이 이곳에 ‘청동 저지선’을 치고 북한군과 치열한 접전을 벌여 지금도 당시의 방공호가 곳곳에 남아 있다. <br />※봄에 초안산 인근 우이천길을 걸으면 흐드러진 벚꽃 속에서 봄을 온몸으로 맞이할 수 있다.<br />※2013년‘G마켓, 생명의숲이 함께하는 초록숲길 만들기’사업 대상 노선으로 노선 전체에 초록숲길 안내표지판 설치 ","초안산 나들길(초록숲길)","생태문화길","강북권","초급"
"82","서대문구","13.04km","4시간","0","","","","진입로 1 : 홍제역 지하철 3호선 1번 출입구 <br />    진입로 2 : 도보접근 <br />    진입로 3 : 녹번역 지하철 3호선 1번 출입구 <br />    진입로 4 : 상명대후문 버스정류장(01-584) 마을버스 종로13 <br /> 진입로 5 : 상명대입구 버스정류장(01-287)지선버스 7212, 1020, 1711, 7022 <br /> ※교통편의 변경이 있을 수 있으니 출발전 확인 바랍니다.   "," 인왕산~개미마을~탕춘대성문~상명대~현통사~백사실계곡"," 이 길은 조선시대에 축조된 탕춘대성 성곽을 따라 걷는 홍제동 산책로다. 북한산의 지맥을 이어받아서일까. 탕춘대성 오솔길은 높지 않으면서도 장쾌한 조망을 선사한다. 홍제동에서는 홍지문, 오간수문과 고려시대의 석불인 보도각 백불을 볼 수 있다. 이중 숙종 45년에 세워진 홍지문의 편액은 숙종의 친필로 홍지문은 한성의 북쪽에 있는 문이어서 한북문이라고도 불렸다. 탕춘대성을 서울성과 혼동하는 경우가 있지만 탕춘대성은 서울성과 북한산성을 잇는 성곽을 말한다.  <br />  <div class='table_css'> <table  cellpadding='0' cellspacing='0' width='100%' summary='세부코스정보 관련 테이블 입니다.' class='table_sub mar_tp20'> <caption>※ 세부코스</caption> 	<tr> 		  <th colspan='2' scope='col' class='end'>세부코스</th> 		  <th scope='col'>거리(km)</th> 		  <th scope='col'>소요시간</th> 		  <th scope='col'>비고</th> 	  </tr> 	<tr> 		<td rowspan='3' class='end' >탕춘대성길</td> 	</tr> 	<tr> 		  <td>1</td> 		  <td>6.7</td> 		  <td>2시간</td> 		  <td>홍은동 교차로(홍제역)~탕춘대성문~홍은동 교차로(홍제역)</td> 	</tr> 	<tr> 	 	  <td>2</td> 		  <td>6.9</td> 		  <td>2시간</td> 		  <td>홍은동 교차로(홍제역)~기차바위~상명대입구</td> 	</tr>   	 </table> </div>","탕춘대성 숲 나들길","생태문화길","강북권","고급"
"83","용산구,중구","1.88km","1시간","0","","","","진입로 1 : 순천향대학병원 버스 정류장(03-163) 직행버스 9007, 9003, 9300, 7900, 8800, 9001, 1005-1, 5500, 5500-2, 5500-1, 9000, 1150, 5007, 5000, 5005, 8100, 광역버스 9401, 9401B  <br /> ※교통편의 변경이 있을 수 있으니 출발전 확인 바랍니다.   "," 단국대학교~매봉산공원~힐사이드아파트~남산공원길"," 도심 속 작은 숲 속으로 인근 주민들이 산책을 즐기며 남산과도 이어진다.","한남매봉공원 산책길","생태문화길","강북권","초급"
"84","동작구","7.34km","4시간30분","0","4호선,9호선","","","진입로 1 : 동작역 지하철 4, 9호선 8번 출구 <br />      진입로 2 : 삼성래미안 롯데캐슬 버스 정류장 20-503 동작 마을버스 07, 16 <br />      진입로 3 :  동작역 지하철 4, 9호선 3번 출입구 <br />      진입로 4 : 정금마을 20-701 동작 마을버스 07 <br />  ※교통편의 변경이 있을 수 있으니 출발전 확인 바랍니다.     "," 정국교~박정희대통령묘소입구~호국지장사~육탄10용사 현충비"," 군인?군무원으로서 사망한 사람과 국가에 공이 있는 사람의 유골 또는 시신을 안장한 국립현충원을 도는 산책로이다. 200m 정도 되는 이 나무계단만 올라가면 국립현충원 외곽을 따라 도는 산책로가 편안한 길을 펼쳐낸다.","현충원 나들길","생태문화길","강남권","중급"
"85","관악구,금천구","3.95km","3시간","0","1호선,7호선","","","진입로 1 : 범일운수종점 버스정류장(18-708) 지선버스 5413,5525,5537,5617,5619,5620 <br /> - 지하철 1, 7호선 가산디지털단지역 1번 출구 가산디지털단지역 버스 정류장(18-209)에서 지선버스 5537번 탑승 가능 <br /> 진입로 2 : 호압사입구(18-137) 간선버스 152, 지선버스 5517,6515,8541 <br /> ※교통편의 변경이 있을 수 있으니 출발전 확인 바랍니다.   ","시흥계곡 입구~산복약수터연못~생태통로~호암폭포~호압사"," 호압사에서 산기슭공원에 이르는 생태 탐방로로서 식생이 다양하다. 자연형 돌계단 등을 조성해 산책로를 정비하여 지역주민의 휴식공간으로 각광 받고 있다. 호암산은 해발 393m로 관악산에서 이어진 삼성산의 지맥으로 금천구의 진산이며 관악산 전체의 서쪽에 위치하고 산세가 북쪽(한양)을 바라보는 호랑이 형상을 닮았다 하여 붙여진 이름이라고 한다. 호암산에는 호암산성과 한우물, 석구상, 호압사, 불영사 등 많은 사적과 유서깊은 사찰이 있으며, 등산로가 가파르지 않고 도심에서 쉽게 접근할 수 있어 금천구, 광명시, 안양시민들의 산행으로 많이 찾는 곳이다. 호암산 정상에서 바라보는 서울시내 풍광과 서남쪽의 전경은 그지없이 아름다워 발길을 멈추게 한다.","호암산 나들길","생태문화길","강남권","고급"
"86","마포구","3.12km","2시간","0","2호선,6호선,공항철도","","","진입로 1 : 광흥창역 지하철 6호선 1번 출입구 <br />    진입로 2 : 홍대입구역 지하철 2호선, 공항철도 7번 출입구 <br />    진입로 3 : 홍대입구역 지하철 2호선, 공항철도 9번 출입구 <br />    진입로 4 : 상수역 지하철 6호선 2번 출입구 <br />  ※교통편의 변경이 있을 수 있으니 출발전 확인 바랍니다.   "," 공민왕 사당~와우공원~근현대디자인박물관~홍대걷고싶은길"," 광흥창역에서 시작하는 이 길은 자연과 젊음을 동시에 만끽할 수 있는 길이다. 시작부터 마포의 역사가 서린 공민왕 사당을 만난 후 와우산 산책을 하고, 지칠 때 즈음 와우산 약수터에서 시원한 물 한 잔을 할 수 있다. 산에서 내려오면 홍대 어린이공원, 걷고 싶은 거리, 피카소 거리 등 신선하고 충격적인 문화 속 산책을 하게 된다.","홍대예술의거리 나들길","생태문화길","강북권","중급"
"87","동대문구","1.83km","1시간","0","6호선","","","진입로 1 : 고려대역 지하철 6호선 3번 출구 <br />  ※교통편의 변경이 있을 수 있으니 출발전 확인 바랍니다.   "," 홍릉수목원 입구~조경인의 숲"," 안암동 고려대학교에서 회기동 경희대학교로 넘어가는 도로변에 위치한 국립산림과학원. 그 안에 살아 숨 쉬는 홍릉수목원은 우리나라 최초의 수목원으로 44만㎡ 면적에 수많은 국내식물이 식재되어 있다. 형형색색의 기화요초는 거대한 정원을 연상하게 만들고 아름드리나무들 사이로 조성된 2㎞ 산책로는 ‘도심 속 오아시스’를 느끼게 한다. <font color = 'red'>단, 홍릉수목원은 식물 연구 중심의 수목원이라 평일에는 일반인에게 개방되지 않으므로 토요일, 일요일에 이용해야 한다(무료)</font> <br />  ※관람시간 : 겨울철(11~2월) 10:00~16:00, 여름철(3~10월) 10:00~17:00<br /> ※자세한 사항은 국립산림과학원(홍릉숲)홈페이지에서 확인하실 수 있습니다.<br /> ※문의전화 : 02-961-2552","홍릉수목원길","생태문화길","강북권","초급"