"순번","자치구","거리","소요시간","추천수","연계지하철역","연계코스","연계공원","교통편","상세코스","설명","코스명","코스대분류","강남강북구분","코스레벨"
"1","강서구","2.51km","1시간30분","0","9호선","","","진입로 1 : 양천향교역 지하철 9호선 2번 출입구<br /> ※교통편의 변경이 있을 수 있으니 출발전 확인 바랍니다."," 양천향교~겸재정선기념관~구암공원~허준박물관"," 강서구의 명소들을 차례로 들르며 걷게 되는 코스 가장 먼저 서울 유일의 향교인 양천향교를 지난다.","강서문화 산책길","생태문화길","강남권","초급"
"2","성북구","2.20km","1시간30분","0","4호선,6호선","","","진입로 1 : 길음역 지하철 4호선 2번 출구 <br /> 진입로 2 : 통일교회 버스 정류장 마을 성북15, 21 <br /> 진입로 3 : 도보진입 <br /> 진입로 4 : 고려대아이스링크 버스 정류장 마을 성북20 <br /> 진입로 5 : 도보진입 <br />  진입로 6 : 고려대역 지하철 6호선 1번 출구 <br /> ※교통편의 변경이 있을 수 있으니 출발전 확인 바랍니다.       "," 개운초등학교~성북구의회~고려대 북문"," 대도시에서 “녹색허파”로서의 역할과 수도권 주민들의 자연휴식처로 크게 애용되고 있다. 개운산은 성북구 안암동에 있는 산으로서 안암산, 진석산(陳石山)이라고도 한다. 노선 주변에는 태조 5년(1396) 왕사 무학이 창건한 개운사가 있어 산의 이름이 되었다. 산 중턱 이상까지 도로가 놓여져 접근하기 쉬우며 산을 한 바퀴 빙 둘러볼 수도 있고, 이 코스처럼 중턱 숲길을 따라 걷다 고려대 캠퍼스의 고풍스러운 건물을 감상하는 길로 연결해 볼 수도 있다. 개운산은 정상과 중턱 오솔길 모두 성북구에서 공을 들여 가꾼 흔적이 역력하다. 또 정상 조망대에서는 그리 높지 않은 곳임에도 시원한 도심 전망을 만끽할 수 있다.","개운산 숲 나들길","생태문화길","강북권","초급"
"3","구로구","1.50km","1시간","0","1호선","","","진입로 1 : 오류동역 지하철 1호선 1번 출구 <br />      진입로 2 : 개봉한진아파트 버스정류장(17-477) 마을버스 구로03 <br />    진입로 3 : 한진아파트 후문 버스정류장(17-749) 마을버스 구로04 <br />   ※교통편의 변경이 있을 수 있으니 출발전 확인 바랍니다.                 "," 배드민턴장~야생화단지~숲속길"," 개웅산은 능선이 세 방향으로 뻗어 내려 삼각형 모양을 이루고 있는 산으로서 산 전체가 단풍나무, 아까시나무, 소나무, 참나무 등 다양한 식생이 잘 보존된 전형적인 자연상태의 공원이다. 연간 10만여 명의 시민들이 이용하고 있으며, 등산로 주변에 약수터와 의자 등 휴게시설이 설치되어 시민들로부터 좋은 반응을 얻고 있다.","개웅산 숲 산책길","생태문화길","강남권","초급"
"4","강서구","7.74km","2시간40분","0","5호선","","","진입로 1 : 개화산역 지하철 5호선 2번 출구 <br />      진입로 2 ~ 5 : 도보접근 <br /> ※교통편의 변경이 있을 수 있으니 출발전 확인 바랍니다.      "," 하늘길 전망대~개화산 호국충혼비~약사사"," 개화산에서 시작하는 이 길은 오솔길과 여러 공원들이 각기 특별한 매력을 발산하며 독특한 재미를 안긴다.","개화산 나들길(강서 둘레길 1,2코스)","생태문화길","강남권","중급"
"5","강동구","1.90km","1시간30분","0","5호선","","","진입로1 : 명일역 지하철 5호선 3번 출입구 <br /> ※교통편의 변경이 있을 수 있으니 출발전 확인 바랍니다.","명일역 3번 출입구~고덕산 정상"," 해발 100m 미만의 낮고 순탄한 숲길이지만 계절 따라 순환하는 자연의 섭리를 그대로 느낄 수 있다. ","고덕산 산책길","생태문화길","강남권","초급"
"6","관악구,금천구","5.58km","2시간","0","2호선","","","진입로 1 : 법대입구 버스 정류장(21-298) 지선버스 5511,5516 <br /> (서울대학교 버스 정류장(21-127)에서 등산로 입구를 통해 관악산야외식물원, 관악산호수공원으로 진입 가능)<br /> - 지하철 2호선 서울대입구역 3번 출구 서울대입구역 버스 정류장(21-330)에서 지선버스 5511, 5513, 5515 탑승 서울대학교(21-127)에서 하차<br /> ※교통편의 변경이 있을 수 있으니 출발전 확인 바랍니다.     "," 관악산호수공원~용천수~관악산야외식물원"," 관악산 계곡길은 사시사철 언제라도 시원한 물줄기를 따라 길을 잇는다. 관악산 등산로는 본래 어려움이 많은 길이지만 이곳에 소개하는 길은 가파른 경사로가 시작되기 직전인 무너미고개 앞 삼거리약수터에서 다시 돌아오도록 되어 있어 남녀노소 누구라도 편안한 걷기를 즐길 수 있다. ","관악산 계곡 나들길","생태문화길","강남권","중급"
"7","관악구,금천구","6.99km","3시간","0","","","","진입로 1 : 신동아아파트 버스 정류장(21-326) 지선버스 5515 <br /> - 지하철 2호선 서울대입구역 3번 출구 버스정류장 서울대입구역(21-330)에서 지선 버스 5515 탑승 가능 <br />        진입로 2 : 삼성산성지 버스 정류장(21-176) 간선버스 152,506 지선버스 6515,5517,5522B,8541 <br />    진입로 3 : 산장아파트 버스 정류장(21-175) 간선버스 152,506 지선버스 6515,5517,5522B,8541 <br /> ※교통편의 변경이 있을 수 있으니 출발전 확인 바랍니다."," 샘말공원~맨발공원~약수암~신우초등학교"," 예전부터 고시원이 밀집된 대학동 일대를 걸을 수 있도록 기 조성된 공원들을 연결하여 고시생들과 주민들이 편하게 이용할 수 있도록 개발된 코스이다.","관악산 나들길","생태문화길","강남권","중급"
"8","관악구,금천구","0.81km","40분","0","","","","진입로 : 사당역 지하철 2, 4호선  4번 출입구"," 관음사~상록약수터"," 오래된 나무와 온갖 풀이 바위와 어우러져 철따라 변하는 모습이 마치 금강산과 같다 하여 소금강 또는 서금강 이라고 불리는 관악산의 관음사는 관악산의 북측에 위치하며, 신라 말기의 고승 도선국사가 895년(진성여왕 9년)에 창건한 유서깊은 사찰이다","관음사 산책길","생태문화길","강남권","초급"
"9","구로구","6.90km","3시간","0","1호선,7호선","","","진입로 1 ~ 3 : 도보진입 <br />      진입로 2 : 신정이펜하우스1단지 버스 정류장 마을버스 양천03 <br />      진입로 3 : 동부골든아파트 후문 버스 정류장 마을버스 구로08 <br />    진입로 4 : 온수역 지하철 1, 7호선 6번 출입구  <br />  ※교통편의 변경이 있을 수 있으니 출발전 확인 바랍니다.","지양산 숲길~차돌바위~궁동터널 위 지양산 숲길 시작","위성사진을 통해 본 지양산 일대는 서울 남서쪽에 동동 떠 있는 커다란 섬이다. 삭막한 도시 속의 오아시스 같은 지양산은 낮고도 넓게 뻗어 수많은 오솔길을 품었다. 많은 산보객들이 발끝으로 반질반질하게 닦아 놓은 청정 숲길은 인근의 매봉산과 원미산으로까지 영토를 넓혔다. 그래서 그 깊은 속살을 다 들여다보려면 몇날 며칠이 필요할 지 가늠하기 어렵다.","구로 지양산 숲 나들길","생태문화길","강남권","중급"
"10","강남구","6.02km","2시간30분","0","3호선","","","진입로 1 :  매봉역 지하철 3호선 4번 출구 <br />      진입로 2 : 능인선원앞 버스 정류장(23-367) 간선버스 141, 지선버스 4412, 순환버스 41 <br /> ※교통편의 변경이 있을 수 있으니 출발전 확인 바랍니다."," 달터근린공원~구룡산길 시작~개암약수터"," 구룡산은 옛날 임신한 여인이 용 열 마리가 승천하는 것을 보고 놀라 소리치는 바람에 한 마리가 떨어져 죽고 아홉 마리만 하늘로 올라갔다 하여 붙여졌다. 코스 대부분이 숲길로 이루어져 햇빛이 비추는 여름에도 시원한 그늘 밑을 걸을 수 있으며 높거나 산길이 험하지 않아 부담 없이 산행을 즐길 수 있다.  다만 구룡산 진입로부터 개암약수터까지는 약간의 오르막이 20분 정도 진행되나 나무계단 등의 편의시설이 있어 노약자도 쉬엄쉬엄 올라가면 진행에 큰 무리는 없다.","구룡산 나들길","생태문화길","강남권","중급"
"11","관악구,금천구","1.22km","40분","0","2호선","","","진입로 1 : 낙성대공원, 영어마을 버스 정류장 마을버스 관악02 <br /> - 지하철 2호선  낙성대역 4번 출구 맞은편에서 마을버스 관악02 탑승 가능 <br /> ※교통편의 변경이 있을 수 있으니 출발전 확인 바랍니다."," 안국사~낙성대공원","낙성대 공원을 지나 관악산 능선과 이어져있고, 강감찬장군 동상, 안국사 등 볼거리가 풍부하다.","낙성대 산책길","생태문화길","강남권","초급"
"12","중구,중랑구","9.17km","3시간","0","1호선,3호선,4호선","","","진입로 1 : 서울역 지하철 1, 4호선 11번 출구 <br />    진입로 2 : 충무로역 지하철 3, 4호선 4번 출구 <br />    진입로 3 : 도보진입 <br />    진입로 4 : 명동입구 버스 정류장(02-149) 간선버스 104, 463, 604, 507, 421, 지선버스 7011, 순환버스 05, 90s투어  <br /> ※교통편의 변경이 있을 수 있으니 출발전 확인 바랍니다.    "," 남산도서관앞~N서울타워~남산공원~와룡묘"," 그 옛날 이 정도 석성을 쌓으려면 도대체 얼마나 많은 인력과 시간이 필요했을까? 하는 의문을 품게 만드는 성곽길로 코스를 시작한다. 서울성곽에 나 있는 길 중에서도 가장 걷기 편한 구간이 바로 이 길의 시작이다. 이후 걷게 되는 남산북측순환산책로는 남산 산책로 중의 으뜸이라 중언부언할 필요가 없을 정도이다. 좋은 길만 엮어 놓았으니 기분 좋게 발걸음 떼는 일만 남았다. <br />※가을에는 곱게 물든 단풍이 장관을 이룬다. 코스 중간에 있는 N서울타워는 각종 공연과 문화 행사 등 볼거리를 제공하고, 사랑의 열쇠탑은 연인들이 사람을 확인하고 맹세하기 위해 많이 찾는 명소이기도 하다.","남산 순환 나들길","생태문화길","강북권","중급"
"13","용산구,중구","2.29km","1시간","0","6호선","","","진입로 1 : 한강진역 지하철 6호선 1번 출구 <br /> ※교통편의 변경이 있을 수 있으니 출발전 확인 바랍니다.  "," 라틴아메리카 공원~야생화 공원~ 팔도소나무 단지"," 남산식물원은 서울시 중구 남산에 있던 식물원으로 1968년 개원하여 2006년까지 운영되었다. 2009년부터 노후화된 시설을 철거하고 실개천, 휴게공간 조성 및  녹지공간 복원 등을하여 2010년말 새롭게 개장했다. 숲길이 잘 정비되어 있고 다양한 식물들이 풍성해 보행자들에게 산책의 묘미를 느끼게 해주는 코스이다.","남산야외식물원 산책길","생태문화길","강북권","초급"
"14","양천구","0.59km","30분","0","9호선","","","진입로 1 : 염창역 지하철 9호선 4번 출입구 <br />    진입로 2 ~ 4 : 도보진입 <br /> ※교통편의 변경이 있을 수 있으니 출발전 확인 바랍니다.    "," 진입마당~생태연못~야생초화원~달맞이언덕~아카시아나무 숲길~전망데크~숲속길~보호초식물화원"," 달마을근린공원은 양천구가 2009년 7월 생태공원으로 재조성한 곳이다. 순환산책로 730m를 만들고 진입광장과 출입구 5곳을 새로 꾸몄으며 정자 1곳과 공원 전체조망이 가능한 전망데크, 야외 체육시설도 설치했다. 또 아카시나무가 주를 이뤘던 산에 팥배나무 등 30종 3만 1000주의 나무를 심었으며, 물억새 등 초화류 및 수생식물 30종 12만 2500여본을 심어 생태적으로 건강한 주민휴식처로 변모했다.","달마을공원 산책길","생태문화길","강남권","초급"
"15","강남구","4.80km","3시간","0","3호선","","","진입로 1 : 도보접근(서울로봇고등학교 앞) <br /> -일원역 지하철 3호선 5번 출구에서 도보로 이동(약 500m) 서울로봇고등학교로 갈 수 있다 <br />      진입로 2 : 세곡2보금자리 <br /> ※교통편의 변경이 있을 수 있으니 출발전 확인 바랍니다. "," 실로암 약수터~대모산 초소위~독도모형~대모산 정상"," 코스 대부분이 숲길이며, 대모산은 해발 293m의 야트막한 산으로 서쪽의 구룡산과 능선을 나란히 하고 있어 연결하여 많은 사람들이 걷는다. 예전에는 국수봉이라고 불렸던 산으로 인근에 아파트단지들이 많이 들어서 주민들의 휴식공간으로 이용되고 있다. 아침 운동이나 가벼운 산책을 즐기려는 주민들이 많이 찾는다. 동쪽 끝은 수서역 4번 출구와 맞닿아 있다.","대모산 나들길","생태문화길","강남권","중급"
"16","용산구,중구","6.02km","2시간","0","1호선,2호선","","","진입로 1 : 시청역 지하철 1, 2호선 10번 출구 <br /> 진입로 2 : 서울신문사 버스 정류장(02-137) 간선버스 101, 150, 402, 501, 506, 405 지선버스 1711, 7016 순환버스 91s투어 <br /> 진입로 3 : 도보진입 <br /> ※교통편의 변경이 있을 수 있으니 출발전 확인 바랍니다.    "," 덕수궁 돌담길~대한문~경운궁 양이재~홍화문~정동공원"," 옛 정취가 그대로 살아있는 높다란 돌담길을 걷다 정동극장, 구러시아공사관, 서울의 역사가 고스란히 담긴 서울 역사박물관 등을 거치며 다양한 볼거리와 배울거리를 만나는 서울 도심의 보석 같은 코스","덕수궁 산책길","생태문화길","강북권","초급"
"17","종로구","8.60km","3시간30분","0","3호선","","","진입로 1 : 도보진입  <br />    진입로 2 : 경복궁역 지하철 3호선 5번 출입구 <br />   진입로 3 : 종로4가종묘 버스 정류장(01-195) 간선버스 201,260,262,270,271,370,720,721,N10,N26 <br /> ※교통편의 변경이 있을 수 있으니 출발전 확인 바랍니다.            "," 경복궁~국립민속박물관~종로문화원~창덕궁~창경궁~종묘"," 서울의 대표적인 궁궐 세 곳과 종묘를 걷는 코스다. 조선의 정궁인 경복궁에서 시작해 조선궁궐의 원형이 잘 보존된 창덕궁과 그 후원인 비원을 거쳐 창경궁을 거닌 후, 역대 왕과 왕비들의 신위를 모신 종묘에서 걷기를 마무리한다. 걷는 거리는 10㎞가 채 안되지만 아름다운 전각과 연못들을 감상하다보면 걷는 시간은 생각 이상으로 오래 걸릴 수밖에 없다. <br />    ※궁궐 관람시간 및 이용정보는 문화재청(1600-0064)로 문의","도심고궁 나들길","생태문화길","강북권","중급"
"18","서대문구","3.80km","2시간","0","3호선","","","진입로 1 : 독립문역 지하철 3호선 4번 출입구 <br /> ※교통편의 변경이 있을 수 있으니 출발전 확인 바랍니다.     "," 서대문 독립공원~안산조망대~안산초화원 포장 산책로"," 옛 서울의 서쪽 관문인 독립문사거리 옆, 독립공원엔 일제강점기 아픈 역사의 흔적을 고스란히 재현해 놓은 서대문 형무소가 있고, 그 뒤로는 안산의 한적한 숲길과 산책로가 조성된 코스이다. 낮지만 웅장한 안산, 그 안산이 내어준 도시자연공원의 한적한 숲길과 독립공원을 한데 엮은 서대문 산책은 발로만 느끼기에는 보고 생각할 일이 너무도 많다.","독립공원안산 나들길","생태문화길","강북권","중급"
"19","관악구,금천구","5.61km","3시간","0","","","","진입로 1 : 독산고등학교 버스 정류장(18-200) 지선버스 5525,5616 <br /> 진입로 2 : 뉴서울아파트 버스 정류장(21-509) 마을버스 관악10 <br /> 진입로 3 : 우림시장,난곡보건분소 버스 정류장(21-214) 간선버스 506, 지선버스 5522B호암,5523,5524,5615,5616 <br /> 진입로 4 : 흥일초등학교앞 버스 정류장(18-740) 지선버스 5621 <br /> 진입로 5~8 : 도보진입 <br /> 진입로 9 : 구민문화체육센터 버스정류장 마을버스 금천08(지하철 1호선 독산역 1번 출구 맞은편에서 탑승 가능) <br /> ※교통편의 변경이 있을 수 있으니 출발전 확인 바랍니다.","감로천생태공원~금천전망대~산림감시초소~호압사입구 사거리"," 노후시설을 정비하여 누구나 안전하고 편안하게 걸을 수 있도록 조성되어 있다. 특히 만수천 생태연못과 감로천 생태공원, 야생초화원 등으로 구성되어 다양한 식생과 많은 볼거리를 가지고 있다. <br /> ※봄이면 야생초화원의 싱그러운 봄 향기를 온몸으로 느낄 수 있다. 금천정 전망대에서 보는 조망도 좋고, 금천체육공원에는 숲속 도서관이 있어 책을 빌려 숲속에서 읽거나 도서관에서 여러 프로그램을 체험할 수도 있다.","독산ㆍ삼성산 나들길","생태문화길","강남권","초급"
"20","동작구","2.80km","1시간30분","0","9호선","","","진입로 1 : 노들역 지하철 9호선 4번출입구 <br />      진입로 2 : 상도터널본동 버스 정류장(20-157) 간선버스 501,506,750A,750B,752 <br />      진입로 3 ~ 7 : 도보진입 <br /> ※교통편의 변경이 있을 수 있으니 출발전 확인 바랍니다.                 "," 노량진근린공원입구~고구동산조명명소~서달산자연생태탐방로~달마사"," 편안한 등산로와 노량진 근린공원이 있어 인근 주민들이 많이 이용한다.      (동작구 전체를 아우르는 코스로 7개의 코스로 구분됨.)","동작충효길(1코스_고구동산길)","생태문화길","강남권","중급"
"21","동작구","2.50Km","1시간","0","4호선,7호선","","","진입로 1 : 삼성래미안.롯데캐슬 버스 정류장 동작 마을버스 07, 16 <br /> - 지하철 4, 7호선 이수역 10번 출구에서 마을버스 동작16 탑승<br />      진입로 2 : 도보진입 <br />      진입로 3 : 정금마을 버스 정류장 동작 마을버스 07 <br /> - 지하철 4, 7호선 이수역 2번 출구에서 마을버스 동작07 탑승<br /> ※교통편의 변경이 있을 수 있으니 출발전 확인 바랍니다.                 "," 국립현충원입구~사당출입문~서달산산책로"," 현충원 인근 산길을 걸을 수 있는 코스이며, 낮은 산으로 산책에 부담이 없고 바로 옆 현충원과 통해 볼거리와 휴식처를 제공하고 있다.       (동작구 전체를 아우르는 코스로 7개의 코스로 구분)","동작충효길(2코스_현충원길)","생태문화길","강남권","중급"
"22","동작구","3.96km","2시간","0","1호선,4호선,9호선","","","진입로 1 : 노량진역 지하철 1호선 1번 출입구 <br />    진입로 2 : 노들역 지하철 9호선 2번 출입구 <br />    진입로 3 : 동작역 지하철 4, 9호선 2번 출입구 <br /> ※교통편의 변경이 있을 수 있으니 출발전 확인 바랍니다.             "," 사육신공원입구~노량진배수지시민공원~효시정"," 한강을 따라 걸을 수 있는 구간으로 사람들이 이용이 많다. 인근 뚝섬과도 연결이 되어있어 가족이나 연인들의 데이트 코스로도 좋다.    (동작구 전체를 아우르는 코스로 7개의 코스로 구분)","동작충효길(3코스_한강나들길)","생태문화길","강남권","중급"
"23","동작구","3.73km","1시간30분","0","1호선,9호선","","","진입로 1 : 지하철 1호선 노량진역 2번 출입구 <br />  진입로 2 ~ 4: 도보 진입 <br /> ※교통편의 변경이 있을 수 있으니 출발전 확인 바랍니다.    "," 노량진수산시장~대방e편한세상~노량진 근린공원~무장애 등산로"," 노량진 수산시장을 지나 노량진근린공원, 무장애 등산로등 다양한 볼거리가 있다.    (동작구 전체를 아우르는 코스로 7개의 코스로 구분)","동작충효길(4코스_노량진길)","생태문화길","강남권","중급"
"24","동작구","2.50km","1시간30분","0","7호선","","","진입로 1 : 보라매역 지하철 7호선 6번 출입구 <br />    진입로 2 : 신대방삼거리역 지하철 7호선 5번 출입구 <br /> ※교통편의 변경이 있을 수 있으니 출발전 확인 바랍니다.    "," 보라매e편한세상아파트~보라매삼성아파트~동작구민회관"," 접근성이 좋고, 보라매공원 이용객, 아파트주민들과 인근 거주하고 있는 주민들이 많이 이용하고 있다.    (동작구 전체를 아우르는 코스로 7개의 코스로 구분)  ","동작충효길(5코스_보라매길)","생태문화길","강남권","중급"
"25","동작구","4.58km","2시간","0","7호선","","","진입로 1 : 신대방삼거리역 지하철 7호선 2번 출입구 <br />    진입로 2 : 숭실대입구역 지하철 7호선 1번 출입구 <br />    진입로 2 : 도보진입 <br /> ※교통편의 변경이 있을 수 있으니 출발전 확인 바랍니다.           "," 청운종합복지원~동작관악적십자봉사관~상현중학교"," 진입로가 많이 있고 버스정류장이나 아파트가 많이 있어 주민들이 산책하기 좋은 코스이다.    (동작구 전체를 아우르는 코스로 7개의 코스로 구분)","동작충효길(6코스_동작마루길)","생태문화길","강남권","중급"
"26","동작구","3.53km","1시간30분","0","2호선,4호선,7호선","","","진입로 1 : 사당역 지하철 2, 4호선 6번 출입구 <br />    진입로 2 : 남성역 지하철 7호선 2번 출입구 <br /> ※교통편의 변경이 있을 수 있으니 출발전 확인 바랍니다.    "," 서울시립남서울미술관~생태통로~경로당, 어린이놀이터~북카페"," 야트막한 산으로 인근 주민들이 자주 찾는 코스이며, 접근성이 좋고 산책과 등산을 모두 할 수 있는 코스이다. 까치산에는 약 2.2㎞에 걸쳐 진초록 흙길이 열린다. 중간에 찻길로 끊긴 곳은 생태육교가 연결되어 자연스럽게 발길을 이어갈 수 있다. 다양한 활엽수가 길옆으로 도열하며, 곳곳에 생활체육시설과 쉼터가 놓여 있다.    (동작구 전체를 아우르는 코스로 7개의 코스로 구분)","동작충효길(7코스_까치산길)","생태문화길","강남권","초급"
"27","중랑구","5.51km","2시간30분","0","","","","진입로 1 : 용마문화복지센터 버스 정류장(07-195) 간선버스 271, 지선버스 1213, 2013, 2230<br /> - 지하철 7호선 면목역 2번 출구 지하철7호선면목역 버스 정류장(07-228)에서 지선버스 1213, 2013 탑승 가능 <br /> ※교통편의 변경이 있을 수 있으니 출발전 확인 바랍니다.    "," 전망대~망우사색의 길"," 망우리 묘지 이장지역을 생태적으로 복원하여 사계절 즐길 수 있는 공원으로 조성하였다. 묘역을 끼고 있어 왠지 오싹한 느낌이 들 것 같지만 막상 공원에 들어서면 무덤들이 울창한 숲에 가려져 보이지 않아 자연의 여유로움을 만끽할 수 있다. 산책 중간에 박인환 시인의 묘소에 들러 “목마와 숙녀”를 음미할 수 있으며, 주변 곳곳에 있는 어린이 운동의 효시인 방정환, 민족대표 33인 중 오세창, 한용운 선생 등 연보비 앞에서 잠깐 걸음을 멈추고 역사를 음미하는 시간을 갖는 것도 좋을 것 같다. ","망우산숲나들길","생태문화길","강북권","중급"
"28","송파구","3.67km","3시간","0","5호선,8호선","","","진입로 1 : 몽촌토성역 지하철 8호선 1번출입구 <br />    진입로 2 : 올림픽공원남2문 버스 정류장(24-240) 일반 30, 30-5 지선버스 3412, 3413 <br />    진입로 3 : 도보접근 <br />    진입로 4 : 올림픽공원역 지하철 5호선 1번 출입구 <br /> ※교통편의 변경이 있을 수 있으니 출발전 확인 바랍니다.","몽촌토성~한성백제박물관~몽촌토성길~88호수"," 도시공원의 의미는 자연휴식공간이라는 데 있다. 아울러 산책로를 만들어 도시민들이 걷고 뛰며 운동할 수 있도록 하는 목적도 지녔다. 강남권 도심, 잠실 주변엔 거대한 녹지공원인 올림픽공원이 있다. 특히 석촌호수에서 가까운 올림픽공원 산책로는 백제 때 축조된 몽촌토성까지 품고 있으며 2012년에는 몽촌토성에서 찾을 수 있는 백제의 역사를 알려주는 한성백제 박물관도 개관하여 더욱 볼거리가 풍부해졌다. (‘Free course' 로 자유롭게 다닐 수 있도록 조성)","몽촌토성 나들길","생태문화길","강남권","중급"
